{
  "project": "Praxis Creator Commitment",
  "version": "1.0",
  "creator": "Stavros",
  "contribution": "Public art, dance, creator workshops and community events.",
  "cityNeed": "Accessible creative spaces where artists and residents can meet, create and collaborate.",
  "commitment": "I would contribute my creative skills and community energy to help build an active cultural neighborhood.",
  "wallet": "0x0000000000000000000000000000000000000000",
  "timestamp": "2026-09-23T00:00:00.000Z"
}
